<?xml version="1.0" encoding="utf-8"?>
<dialect xmlns:xsi="http://www.w3.org/2001/XMLSchema-instance" type="SQLSERVER" xsi:noNamespaceSchemaLocation="dialect.xsd">
    <procedures>
        <procedure procedureClass="com.oltpbenchmark.benchmarks.epinions.procedures.GetReviewItemById">
            <statements>
                <statement name="getReviewItem">
                    SELECT TOP 10 * FROM review r, item i WHERE i.i_id = r.i_id and r.i_id=?
                    ORDER BY rating;
                </statement>
            </statements>
        </procedure>
        <procedure procedureClass="com.oltpbenchmark.benchmarks.epinions.procedures.GetReviewsByUser">
            <statements>
                <statement name="getReviewUser">
                    SELECT TOP 10 * FROM review r, [useracct] u WHERE u.u_id = r.u_id AND r.u_id=?
                    ORDER BY rating;
                </statement>
            </statements>
        </procedure>
        <procedure procedureClass="com.oltpbenchmark.benchmarks.epinions.procedures.UpdateUserName">
            <statements>
                <statement name="updateUser">
                    UPDATE [useracct] SET name = ? WHERE u_id=?;
                </statement>
            </statements>
        </procedure>
    </procedures>
</dialect>
